<!ELEMENT students (student*)>
<!ELEMENT student (name, surname, class)>
<!ELEMENT name (#PCDATA)>
<!ELEMENT surname (#PCDATA)>
<!ELEMENT class (#PCDATA)>